{
  "schema_version": "observation-truth/v1",
  "grid_id": "kma_60_127",
  "nx": 60,
  "ny": 127,
  "variable": "temperature_air_2m",
  "value_kind": "continuous",
  "value": 23.5,
  "unit": "degC",
  "observed_at": "2026-08-20T12:00:00+09:00",
  "truth_source": "observation_source_pending_approval",
  "truth_revision": "example-r1",
  "truth_as_of": "2026-08-20T13:00:00+09:00",
  "collected_at": "2026-08-20T13:05:00+09:00",
  "quality": "final"
}
